{
 "schema": "cognicopia-coloring-art/1",
 "id": "pocket-watch",
 "mode": "replace",
 "title": "The Pocket Watch",
 "category_id": "nostalgic-heritage",
 "fit": "subject",
 "pad": 0.05,
 "items": [
  [
   "d",
   1,
   "M310 105.3 C314.3 102.7 318.4 102.6 322.7 105.3 M310 105.3 C309.4 108.4 307 110.3 305.9 113.2 C304.1 117.7 303.4 123.1 304 127.9 C304.3 130.1 305.3 132.4 305.7 134.7 M310 105.3 C300.2 100.2 291 114.1 291.3 122.8 C291.5 127.4 294.7 130.5 296.1 134.6 M322.7 105.3 C326.8 102.9 331.6 104.5 335.3 107 M322.7 105.3 C321.8 107.2 320.2 108.7 319.4 110.6 C315.7 119.4 315.7 126 316.3 135.3 M335.3 107 C340 105.4 344.1 108.2 347.8 110.8 M335.3 107 C335.2 110.7 336.8 114.1 336.7 117.8 C336.3 124.9 333.7 131.2 331.3 137.7 M347.8 110.8 C354.1 108.5 360.3 119.1 361 124.5 C361.9 132.3 356.7 138 351.9 143.2 M347.8 110.8 C347 114.7 349.1 118.2 348.6 122.1 C348.2 126.3 347.4 131.2 345.5 135 C344.6 136.9 343.1 138.4 342.3 140.3 M296.1 134.6 C299.4 136.1 302.5 136.7 305.7 134.7 M296.1 134.6 C292.9 136.8 289.3 138 286 140 M305.7 134.7 C308.6 136.5 313.4 137.2 316.3 135.3 M385 134.7 C386.5 133 388.4 131.1 389.4 129 C394.3 118.6 393.1 104.9 386 95.8 C382.2 90.8 377.8 86.9 373 83 C353.7 67 318.2 63.8 295 71.5 C278.4 77 262.5 92.9 266.1 111.8 C266.6 114.5 267.8 116.9 268.7 119.4 C271.7 128.4 279.6 133.6 286 140 M385 134.7 C384.6 136.2 383.9 137.5 383.3 139 C385.8 142.8 390 144.7 393.8 147.1 M385 134.7 C383.4 133.5 381.3 131.8 379.3 131.5 C374 130.7 370.4 136.9 371.1 141.3 C371.3 142.8 372.1 144.3 372.7 145.7 M316.3 135.3 C319.4 137.6 328 139.4 331.3 137.7 M331.3 137.7 C334.5 139.8 338.5 141.6 342.3 140.3 M286 140 C283.9 143.5 282.3 147.1 280.6 150.9 M342.3 140.3 C345.2 142.4 348.3 144 351.9 143.2 M351.9 143.2 L361.3 151.7 M410.7 145.3 C417.3 144.9 429.5 155.7 432.2 161.6 M410.7 145.3 C407.4 151.3 412.2 150.7 411.6 155.5 C411 161.2 404.8 161.5 400.9 163.8 M410.7 145.3 C409 144 407.3 142.9 405.4 141.9 M372.7 145.7 C376.4 148.6 380.5 151.9 383.7 155.3 M372.7 145.7 C368.8 148.8 364.9 149.1 361.3 151.7 M393.8 147.1 L396.2 145.7 M361.3 151.7 C360.8 154 361 161.4 361.4 163.9 M383.7 155.3 C384.2 155.3 384.5 154.9 385.2 155.1 C387.8 155.7 398.4 162 400.9 163.8 M383.7 155.3 C382.8 156.8 381.7 158.2 380.9 159.9 M432.2 161.6 C433.7 163.2 435.7 165.1 436.5 167.3 C437.3 169.7 435.4 177.6 432.9 178.8 C432.3 179.1 431.6 178.9 430.9 178.9 M400.9 163.8 C402.7 169.7 417.2 179.9 423.5 180.6 C426.3 181 428.2 178.9 430.9 178.9 M297.4 167.1 C298.9 166.3 300.6 165.1 302.4 165.1 C313 164.8 323.3 167.2 333.4 169.6 C334.8 169.9 336.3 170 337.6 170.6 C339.2 171.3 340.7 172.7 342.1 173.8 M430.9 178.9 C435.6 181.4 440.5 185.9 443.7 190 M295 186.3 C299.6 188.9 304.5 188 309.6 188.4 C315.1 188.7 320.7 189.7 326.1 190.7 C330 191.5 334.5 193.2 338 191.3 M452.1 197.2 C456.6 199.3 462.5 204.8 465.7 208.7 M465.7 208.7 C462.9 213 464.7 215.9 467.1 220 C470.8 226.4 483.8 241.2 491.9 240.6 C493.4 240.6 494.5 239.5 495.7 238.7 M506.3 225.3 C508.4 229.1 514.7 235.8 518.3 238 M506.3 225.3 C504.5 225.1 502.7 224.5 500.8 224.7 C496.6 225.3 493.4 229.8 494 233.9 C494.3 235.5 495.3 237.1 495.7 238.7 M495.7 238.7 C500.3 241.6 505.1 246.8 507.8 251.6 M224.1 257.4 C222.8 256.5 221.5 255.7 220 255 M224.1 257.4 C225.6 256.8 226.8 256.3 228.3 256 M224.1 257.4 C224.4 260.7 225.3 264.5 226.5 267.6 C227.1 269.1 227.6 270 227.8 271.7 M292.1 259.1 C292 260.6 292.2 262.1 292 263.7 M514.8 259.2 C518.7 262.7 523.7 266.9 526 271.7 M538.3 260 C538.3 262.5 539.2 264.7 539 267.3 C538.9 268.5 537.8 270.2 536.9 271 C533.5 274.7 530 273.1 526 271.7 M292 263.7 C288.1 264.9 285.6 271.5 284.3 275.3 M526 271.7 C525.3 272.9 524.2 274.4 524 275.9 C523.2 283.1 533.1 296.8 538.1 301.8 C541.6 305.2 546.1 309.4 551 306.3 M227.8 271.7 C227.1 273.6 225.9 274.3 224.8 276 C222.9 278.9 221.4 282.2 220 285.3 M284.3 275.3 L286.3 276.7 M284.3 275.3 C283.2 275.7 282.6 275.9 281.3 276 M220 285.3 L222.3 286.7 M220 285.3 C218.8 286 218.7 286 217.3 286 M240.9 286.9 C242.1 287.7 243.3 288.4 244.7 289 M190.7 303.3 C191.8 302.9 192.4 302.8 193.7 302.7 M190.7 303.3 C189 306.9 186.3 313.7 182.8 315.1 M190.7 303.3 L188 302 M182.8 315.1 C182.8 316.5 182.8 318 182.7 319.3 M182.7 319.3 C182.1 319.5 181.7 319.3 181.1 319.6 C179.1 321 176 328.2 174.7 330.7 M174.7 330.7 C175.7 331.4 176.4 331.7 177.7 332 M174.7 330.7 C173.7 331.1 173.1 331.4 172 331.7 M212 341.3 L202.3 334 M395.7 353 C397.9 351.6 400.3 350.6 402.3 349 M171.9 373.4 L169.7 372 M171.9 373.4 C172.9 373 173.5 372.8 174.7 372.7 M171.9 373.4 C170.3 377.3 168 383.2 164.1 384.8 M164.1 384.8 L164.2 389.2 M279.3 394.3 C281.8 393.2 283.6 391.3 286 390.1 C295.2 385.5 300.4 391.4 306.4 397.4 M279.3 394.3 C279.3 399.8 277.3 404.6 279.8 409.9 C280.6 411.7 282.5 413.6 284 414.7 C291.7 420.6 300 418 304.9 410 C307.4 405.9 305.8 401.8 306.4 397.4 M157.3 470.3 C156.9 472.2 156.7 474.1 156.7 476 M399.8 473.4 C401.4 472.7 402.6 472.2 404.3 472 M399.8 473.4 C399.7 476.7 400.4 479.8 400.6 483 C401 487 400.9 491.4 401.7 495.4 C401.9 496.2 402.5 496.7 403 497.3 M412 474 L414.3 473.3 M412 474 C411.5 477 406.1 494 404.6 496.3 C404.1 497 403.6 496.9 403 497.3 M412 474 C410.9 473.3 410.2 473 409 472.7 M403 497.3 L402 503.3 M201.3 503 C202.9 502 203.8 501.6 205.7 501.3 M201.3 503 C201.1 507.5 202.1 523.5 204.1 527.1 M201.3 503 L197.3 500.3 M343.3 520 C344.7 519.3 345.8 519 347.3 518.7 M343.3 520 C343.7 525.7 344 539.6 346.4 544.1 M343.3 520 C342 518.9 340.9 518.3 339.3 517.7 M355.7 520.3 L358 519.7 M355.7 520.3 C354.3 526.2 352.1 532.4 349.9 538 C349.4 539.3 349.3 540.8 348.7 542.1 C348 543.3 347.4 543.5 346.4 544.1 M355.7 520.3 L353 518.7 M204.1 527.1 L203.7 532.7 M346.4 544.1 L345.7 550 M270.1 552.4 L269.7 557.7 M284 557.3 C285.4 558.4 286.6 559.1 288.3 559.7 M284 557.3 C282.5 558.1 281.3 558.5 279.7 558.7 M183.8 577.9 C182.9 575.8 182 574.4 180.4 572.8 M183.8 577.9 C187.6 579.7 192.3 579.9 196.5 580.4 C198.9 580.6 201.4 581.4 203.7 581.9 C210.7 583.4 221.5 584.1 227.7 587.3 M232.1 580.4 C228.8 577.8 225 576.4 221.2 574.5 C212.9 570.3 204.3 565.8 196.8 560.1 C190.8 555.5 184.7 550.8 178.9 545.9 C162.6 532 145.2 508.7 135.8 489.4 C120.2 457.3 111.7 421.8 115 386 C117.2 361.2 123.6 336.7 134.9 314.3 C136.9 310.5 138.5 306.6 140.9 303 C142.8 300.1 144.4 296.9 146.3 294 C149.6 289 153.4 284.2 156.9 279.2 C158 277.7 159.5 276.4 160.7 275 C171.8 261.5 184.9 250.5 199.3 240.9 C203.5 238.1 207.7 235.1 212.2 232.7 C227.8 224.4 253 214.8 270.6 213.7 C275.1 213.4 279.5 212.3 284.1 212 C306.4 210.4 329.8 214.4 350.8 221.9 C409.5 242.6 456 299.6 468.4 360.1 C469.3 364.5 470.7 368.9 471.3 373.4 C474.5 398.2 473.8 422.3 468.1 446.7 C460.9 477.7 446.1 506.4 425.6 530.7 C409.6 549.6 388.7 565.4 366.3 575.6 C362.2 577.5 358.2 579.8 354 581.2 C347.7 583.3 341.5 585.3 335.2 587.2 C326.5 589.8 317 591.2 308 592 C302.9 592.4 294.8 591.7 290.7 594.3 M232.1 580.4 C236.5 579.8 244.8 583.1 249.4 584.2 L277.9 590.9 C282.1 591.9 287 592 290.7 594.3 M232.1 580.4 L227.7 587.3 M227.7 587.3 C229.2 591.2 227.5 594.5 225.2 597.8 M290.7 594.3 C291.2 597.2 290 599.5 291.1 602.2 M225.2 597.8 C221.8 596.6 218.4 596.3 214.8 595.6 C206.9 594 198.8 592.8 190.8 591.2 C164 585.9 136.4 584.6 109.1 585.7 C102.5 585.9 95.9 586 89.4 587.4 C77.9 589.9 59.3 593.5 53 604.9 C45 619.6 64.3 636.7 74.9 644.3 C82.9 650.2 91.2 655.6 99.8 660.6 C119 671.9 140.2 680 160.9 688.2 C163 689 165.4 689.4 167.5 690.2 C186.4 697.4 206.5 703.2 226.4 707.1 C234.9 708.7 243.4 711.2 252 712.6 C277.6 716.7 303.4 720 329.3 720 C349.5 720 369.9 717.8 388.8 710.7 C399.8 706.6 408.2 697.8 404.9 685.4 C402 674.8 388.9 663.9 380.2 657.8 C362.3 645.1 343.7 636 323.9 626.8 C315.8 623 306.9 619.9 298.4 616.8 C294.9 615.6 291.2 614.7 288.1 612.6 M225.2 597.8 C228.5 602.3 233.9 602.2 238.9 603.4 C250.3 606.3 261.7 609.7 273.2 612.2 C275.4 612.7 283.3 615.2 284.9 614.9 C286.3 614.6 287.1 613.5 288.1 612.6 M291.1 602.2 C296.6 605.1 303.1 606.5 308.9 608.8 C312.9 610.3 316.8 612.3 320.8 613.5 C323 614.1 325.4 613.9 327.6 614.4 M291.1 602.2 C288.7 605.1 286.7 608.9 288.1 612.6 M35.3 623 C36.1 623.2 36.5 623 37.2 623.5 C39.6 625.6 41.2 628.9 43 631.5 C44.7 633.9 46.8 636.1 48.7 638.3 C55.3 646.3 66.9 654.3 75.4 660.3 C79.3 663 83.6 665.4 87.8 667.7 C98.5 673.5 109 680 120.2 684.8 C137.5 692.2 154.9 699 172.5 705.5 C175.3 706.6 178.5 707.2 181.4 708.2 C192.6 711.8 204 714.8 215.4 717.4 C258.4 727.1 300.5 734.2 344.8 732.3 C358.2 731.8 371.9 730 384.9 726.6 C390.7 725 396.2 722.3 401.8 720.2 C403.6 719.6 405.1 718 406.9 717.5 C408.1 717.3 409.7 717.7 410.9 717.8 M286.7 226.1 C288.9 225.6 291.5 226 293.8 226 C303.9 226 314.6 226.9 324.6 229.1 C327.2 229.7 329.8 230.6 332.4 231.2 C366.4 239.1 402.3 264 422.5 292.3 C429.7 302.3 435.3 312.2 441 323 C443.2 327.3 445.6 331.7 447.1 336.3 C449.2 342.8 451.7 349.2 453.6 355.7 C458.6 373.5 460.7 393 459.7 411.5 C457 458.6 435.6 504.3 400.9 536.4 C391.6 545.1 380.6 552 369.6 558.3 C357.5 565.3 344 571 330.4 574.3 C315.4 577.8 298.9 579.6 283.6 577.7 C281.3 577.4 278.9 577.7 276.6 577.3 C256.8 573.9 234.7 567.7 217.5 557.1 C207.1 550.7 196.7 543.8 187.7 535.4 C148.8 499.2 126.8 447.6 128.3 394.4 C128.5 387.8 129.8 381.4 130.6 374.9 C131.2 370.1 131.9 365.2 133.1 360.5 C142.5 323.4 161.6 289.5 190.9 264.4 C194.9 261.1 199.3 258.4 203.4 255.3 C211.5 249 222 242.9 231.7 239.1 C241.9 235.1 252.5 231.1 263.4 229.1 C268.7 228.1 274.1 227.4 279.5 226.7 C281.9 226.4 284.3 226.6 286.7 226.1 Z M506.3 225.3 C509 220.5 507.2 217.3 504.3 213 C499.7 206.1 488.3 191.8 479.1 192.1 C477.6 192.1 476.2 193.5 475.1 194.3 C475.8 196.2 477.2 198.2 477.6 200.3 C477.8 201.5 477.4 202.6 477.1 203.8 C475.5 209.6 470.4 208.8 465.7 208.7 M292.1 259.1 C289.4 255.7 289.2 248.6 288 247.2 C287 246 285.4 245.5 284 245 M292 263.7 C296.2 269.4 293.5 282.1 305 276.7 M227.8 271.7 C228.1 273.8 229.2 275.2 229.6 277.3 C231 284.3 231.9 290.9 240.9 286.9 M364 302 C365.6 302 366.4 301.7 367.9 301 C370.1 292.2 369.2 282.3 371.2 273.3 C372.6 272.7 373.5 272.5 375 272.3 M182.8 315.1 C180.7 311.8 180 304.6 178.7 302.7 C177.9 301.6 176.1 301.2 175 300.7 M182.7 319.3 C186.4 324 1